{
  "candidate_id": "project-management__delta-specification",
  "service_category": "project-management",
  "framework_name": "delta-specification",
  "status": "seed",
  "source_captures": [
    "chi-openspec-vs-mythos-20260821T143000Z"
  ],
  "source_origins": [
    "https://github.com/Fission-AI/OpenSpec"
  ],
  "created_at": "2026-08-21T15:00:32Z",
  "updated_at": "2026-08-21T15:18:20.000Z",
  "owner": "human framework steward",
  "promotion_ready": false,
  "blocking_issues": [
    "At least 3 source captures or replay cases are required; found 2."
  ],
  "replay_summary": {
    "total": 2,
    "pass": 2,
    "fail": 0,
    "partial": 0,
    "manual_intervention": 0,
    "preflight_only": true,
    "passed_case_ids": [
      "neutral-retention-change"
    ]
  },
  "sanitization_passed": true,
  "learning_required": "required"
}
